OBJECTID_1,Site_Name,Designation_Type,Link_to_CA,Link_to_GMA,Traffic_Light_Colour_using_80__,Notes,Number_of_Marine_Components,Perc_in_Fav_or_Unfav_Recover,GEOGRAPHIC_LOCATION,Country,EST_DATE,STATUS,SITE_CODE,LEAD,Features,Feature_Designation_Dates,Feature_Management_Approaches,Feature_Conditions,Feature_Favourable,Feature_Unfavourable_Recovering,Feature_Unfavourable_No_Change,Feature_Unfavourable_Declining,Feature_Partially_Destroyed,Feature_Destroyed,Feature_Not_Assessed
249,Outer Firth of Forth and St Andrews Bay Complex,SPA,https://sitelink.nature.scot/site/10478,,Recovered/Recovering,,28,0.96428571,,Scotland inshore & Scotland offshore,3/12/2020,,UK9020316,,"Arctic tern (Sterna paradisaea), breeding; Black-headed gull (Chroicocephalus ridibundus), non-breeding; Common gull (Larus canus), non-breeding; Common scoter (Melanitta nigra), non-breeding; Common tern (Sterna hirundo), breeding; Eider (Somateria mollissima), non-breeding; Gannet (Morus bassanus), breeding; Goldeneye (Bucephala clangula), non-breeding; Guillemot (Uria aalge), breeding; Guillemot (Uria aalge), non-breeding; Herring gull (Larus argentatus), breeding; Herring gull (Larus argentatus), non-breeding; Kittiwake (Rissa tridactyla), breeding; Kittiwake (Rissa tridactyla), non-breeding; Little gull (Hydrocoloeus minutus), non-breeding; Long-tailed duck (Clangula hyemalis), non-breeding; Manx shearwater (Puffinus puffinus), breeding; Puffin (Fratercula arctica), breeding; Razorbill (Alca torda), non-breeding; Red-breasted merganser (Mergus serrator), non-breeding; Red-throated diver (Gavia stellata), non-breeding; Seabird assemblage, breeding; Seabird assemblage, non-breeding; Shag (Phalacrocorax aristotelis), breeding; Shag (Phalacrocorax aristotelis), non-breeding; Slavonian grebe (Podiceps auritus), non-breeding; Velvet scoter (Melanitta fusca), non-breeding; Waterfowl assemblage, non-breeding",03/12/2020; 03/12/2020; 03/12/2020; 03/12/2020; 03/12/2020; 03/12/2020; 03/12/2020; 03/12/2020; 03/12/2020; 03/12/2020; 03/12/2020; 03/12/2020; 03/12/2020; 03/12/2020; 03/12/2020; 03/12/2020; 03/12/2020; 03/12/2020; 03/12/2020; 03/12/2020; 03/12/2020; 03/12/2020; 03/12/2020; 03/12/2020; 03/12/2020; 03/12/2020; 03/12/2020; 03/12/2020,-; -; -; -; -; -; -; -; -; -; -; -; -; -; -; -; -; -; -; -; -; -; -; -; -; -; -; -,Y; Y; Y; Y; Y; Y; Y; Y; Y; Y; Y; Y; Y; Y; Y; Y; Y; Y; Y; Y; Y; N; Y; Y; Y; Y; Y; Y,-; -; -; -; -; -; -; -; -; -; -; -; -; -; -; -; -; -; -; -; -; -; -; -; -; -; -; -,-; -; -; -; -; -; -; -; -; -; -; -; -; -; -; -; -; -; -; -; -; -; -; -; -; -; -; -,-; -; -; -; -; -; -; -; -; -; -; -; -; -; -; -; -; -; -; -; -; -; -; -; -; -; -; -,-; -; -; -; -; -; -; -; -; -; -; -; -; -; -; -; -; -; -; -; -; -; -; -; -; -; -; -,-; -; -; -; -; -; -; -; -; -; -; -; -; -; -; -; -; -; -; -; -; -; -; -; -; -; -; -,-; -; -; -; -; -; -; -; -; -; -; -; -; -; -; -; -; -; -; -; -; -; -; -; -; -; -; -,-; -; -; -; -; -; -; -; -; -; -; -; -; -; -; -; -; -; -; -; -; -; -; -; -; -; -; -
250,Solent and Dorset Coast,SPA,https://designatedsites.naturalengland.org.uk/Marine/MarineFeatureCondition.aspx?SiteCode=UK9020330&SiteName=solent&SiteNameDisplay=Solent+and+Dorset+Coast+SPA&countyCode=&responsiblePerson=&SeaArea=&IFCAArea=,http://publications.naturalengland.org.uk/publication/5294923917033472,Condition_Unknown,,3,,,England inshore,16-01-2020,,UK9020330,,"Common tern (Sterna hirundo), A193, b; Little tern (Sternula albifrons), A195, b; Sandwich tern (Sterna sandvicensis), A191, b",16/01/2020; 16/01/2020; 16/01/2020,-; -; -,N; N; N,-; -; -,-; -; -,-; -; -,-; -; -,-; -; -,-; -; -,-; -; -
251,Moray Firth,SPA,https://sitelink.nature.scot/site/10490,,Mixed_Picture,,12,0.5833,,Scotland inshore,3/12/2020,,UK9020313,,"Common scoter (Melanitta nigra), non-breeding; Eider (Somateria mollissima), non-breeding; Goldeneye (Bucephala clangula), non-breeding; Great northern diver (Gavia immer), non-breeding; Long-tailed duck (Clangula hyemalis), non-breeding; Red-breasted merganser (Mergus serrator), non-breeding; Red-throated diver (Gavia stellata), non-breeding; Scaup (Aythya marila), non-breeding; Shag (Phalacrocorax aristotelis), breeding; Shag (Phalacrocorax aristotelis), non-breeding; Slavonian grebe (Podiceps auritus), non-breeding; Velvet scoter (Melanitta fusca), non-breeding",03/12/2020; 03/12/2020; 03/12/2020; 03/12/2020; 03/12/2020; 03/12/2020; 03/12/2020; 03/12/2020; 03/12/2020; 03/12/2020; 03/12/2020; 03/12/2020,-; -; -; -; -; -; -; -; -; -; -; -,Y; Y; Y; Y; Y; Y; Y; Y; Y; Y; Y; Y,-; -; -; -; -; -; -; -; -; -; -; -,-; -; -; -; -; -; -; -; -; -; -; -,-; -; -; -; -; -; -; -; -; -; -; -,-; -; -; -; -; -; -; -; -; -; -; -,-; -; -; -; -; -; -; -; -; -; -; -,-; -; -; -; -; -; -; -; -; -; -; -,-; -; -; -; -; -; -; -; -; -; -; -
252,Outer Thames Estuary,SPA,https://designatedsites.naturalengland.org.uk/Marine/MarineFeatureCondition.aspx?SiteCode=UK9020309&SiteName=outer%20thames%20estuary&SiteNameDisplay=Outer+Thames+Estuary+SPA&countyCode=&responsiblePerson=&SeaArea=&IFCAArea=,http://publications.naturalengland.org.uk/publication/3233957?category=3229185,Mixed_Picture,,3,0.3333,,England inshore & England offshore,1/8/2010,,UK9020309,,"Red-throated diver (Gavia stellata), A001-A, nb; Common tern (Sterna hirundo), A193, b; Little tern (Sternula albifrons), A195, b",20/08/2010; 31/10/2017; 31/10/2017,-; -; -,Y; Y; Y,-; 100%; -,-; -; -,100%; -; 100%,-; -; -,-; -; -,-; -; -,-; -; -
253,West Coast of the Outer Hebrides,SPA,https://sitelink.nature.scot/site/10484,,Recovered/Recovering,,7,1,,Scotland inshore,3/12/2020,,UK9020319,,"Black-throated diver (Gavia arctica), non-breeding; Eider (Somateria mollissima), non-breeding; Great northern diver (Gavia immer), non-breeding; Long-tailed duck (Clangula hyemalis), non-breeding; Red-breasted merganser (Mergus serrator), non-breeding; Red-throated diver (Gavia stellata), breeding; Slavonian grebe (Podiceps auritus), non-breeding",03/12/2020; 03/12/2020; 03/12/2020; 03/12/2020; 03/12/2020; 03/12/2020; 03/12/2020,-; -; -; -; -; -; -,Y; Y; Y; Y; Y; Y; Y,-; -; -; -; -; -; -,-; -; -; -; -; -; -,-; -; -; -; -; -; -,-; -; -; -; -; -; -,-; -; -; -; -; -; -,-; -; -; -; -; -; -,-; -; -; -; -; -; -
254,Greater Wash,SPA,,http://publications.naturalengland.org.uk/publication/4597871528116224,Condition_Unknown,,6,,,England inshore & England offshore,1/3/2018,,UK9020329,,"Common scoter (Melanitta nigra), A065, nb; Common tern (Sterna hirundo), A193, b; Little gull (Hydrocoloeus minutus), A177, nb; Little tern (Sternula albifrons), A195, b; Red-throated diver (Gavia stellata), A001-A, nb; Sandwich tern (Sterna sandvicensis), A191, b",28/03/2018; 28/03/2018; 28/03/2018; 28/03/2018; 28/03/2018; 28/03/2018,-; -; -; -; -; -,N; N; N; N; N; N,-; -; -; -; -; -,-; -; -; -; -; -,-; -; -; -; -; -,-; -; -; -; -; -,-; -; -; -; -; -,-; -; -; -; -; -,-; -; -; -; -; -
255,Bae Cemlyn/ Cemlyn Bay,SAC,https://cdn.cyfoethnaturiol.cymru/enhdeham/condition-assessment-for-cemlyn-bay-sac.pdf,https://naturalresources.wales/media/692032/cemlyn-wes32-plan-english.pdf,Degraded/Degrading,,1,,,Wales inshore,,,UK0030114,,Coastal lagoons; Coastal shingle vegetation outside the reach of waves,01/12/2004; 13/12/2004,-; -,Y; Y,-; -,-; -,-; -,-; -,-; -,-; -,-; -
256,Hascosay,SAC,https://sitelink.nature.scot/site/8270,,Degraded/Degrading,,1,,,Scotland inshore,,,UK0019793,,Blanket bog; Otter (Lutra lutra),17/03/2005; 17/03/2005,-; -,Y; Y,-; -,-; -,-; -,-; -,-; -,-; -,-; -
257,Loch Roag Lagoons,SAC,https://sitelink.nature.scot/site/8305,,Recovered/Recovering,,1,1,,Scotland inshore,,,UK0017074,,Lagoons,17/03/2005,-,Y,-,-,-,-,-,-,-
258,Scanner Pockmark,SAC,https://data.jncc.gov.uk/data/800ba4e2-a661-403d-baa5-155b956779ba/ScannerPockmark-4-ConservationStatements-V1.0.pdf,https://data.jncc.gov.uk/data/800ba4e2-a661-403d-baa5-155b956779ba/ScannerPockmark-4-ConservationStatements-V1.0.pdf,Degraded/Degrading,* Noting it is not considered feasible to restore some of the feature's attributes,1,,,Scotland offshore,,,UK0030354,,Submarine structures made by leaking gases,00/12/2015,-,Y,-,-,-,-,-,-,-
259,North Rona,SAC,https://sitelink.nature.scot/site/8340,,Mixed_Picture,,3,0.33333,,Scotland inshore,,,UK0012696,,"Great northern diver (Gavia immer), non-breeding; Red-throated diver (Gavia stellata), breeding; Slavonian grebe (Podiceps auritus), non-breeding; Velvet scoter (Melanitta fusca), non-breeding",16/02/2022; 16/02/2022; 16/02/2022; 16/02/2022,Maintain; Maintain; Maintain; Maintain,N; N; N; N,-; -; -; -,-; -; -; -,-; -; -; -,-; -; -; -,-; -; -; -,-; -; -; -,-; -; -; -
260,Isle of May,SAC,https://sitelink.nature.scot/site/8278,,Recovered/Recovering,,2,1,,Scotland inshore,,,UK0030172,,Grey seal (Halichoerus grypus); Reefs,17/03/2005; 17/03/2005,-; -,Y; Y,-; -,-; -,-; -,-; -,-; -,-; -,-; -
261,Tweed Estuary,SAC,https://designatedsites.naturalengland.org.uk/Marine/MarineFeatureCondition.aspx?SiteCode=UK0030292&SiteName=tweed&SiteNameDisplay=Tweed+Estuary+SAC&countyCode=&responsiblePerson=&SeaArea=&IFCAArea=,http://publications.naturalengland.org.uk/publication/5015032228216832?category=4698884316069888,Mixed_Picture,,3,0.8333,,England inshore,,,UK0030292,,Coastal Saltmarshes and Saline Reedbeds; Esturine Rocky Habitats; Intertidal Coarse Sediment; Intertidal Mixed Sediments; Intertidal Mud,31/05/2019; 31/05/2019; 31/05/2019; 31/05/2019; 31/05/2019,Maintain in favourable condition; Maintain in favourable condition; Maintain in favourable condition; Maintain in favourable condition; Maintain in favourable condition,N; N; N; N; N,-; -; -; -; -,-; -; -; -; -,-; -; -; -; -,-; -; -; -; -,-; -; -; -; -,-; -; -; -; -,-; -; -; -; -
262,Solent and Isle of Wight Lagoons,SAC,https://designatedsites.naturalengland.org.uk/Marine/MarineFeatureCondition.aspx?SiteCode=UK0017073&SiteName=solent&SiteNameDisplay=Solent+and+Isle+of+Wight+Lagoons+SAC&countyCode=&responsiblePerson=&SeaArea=&IFCAArea=,http://publications.naturalengland.org.uk/publication/5646122018144256,Recovered/Recovering,,1,1,,England inshore,,,UK0017073,,H1150 Coastal lagoons,1/4/2005,-,Y,100%,-,-,-,-,-,-
263,The Vadills,SAC,https://sitelink.nature.scot/site/8393,,Recovered/Recovering,,1,1,,Scotland inshore,,,UK0017068,,Lagoons,17/03/2005,-,Y,-,-,-,-,-,-,-
264,Red Bay,SAC,https://www.daera-ni.gov.uk/sites/default/files/2024-12/Annex%20A%20-%20Report%20on%20the%20Northern%20Ireland%20Inshore%20Marine%20Protected%20Area%20Network%202019%20-%202024%20_To%20PDF_1.pdf,https://www.daera-ni.gov.uk/sites/default/files/publications/daera/Red%20Bay%20SAC%20Conservation%20Objectives%202017.PDF,Recovered/Recovering,,1,1,,Northern Ireland inshore,,,UK0030365,,,,,,,,,,,,
265,Pisces Reef Complex,SAC,https://data.jncc.gov.uk/data/4f8ac443-777f-4a55-a5c8-fc44e80fa965/PiscesReef-4-ConservationStatements-V1.0.pdf,"https://jncc.gov.uk/our-work/pisces-reef-complex-mpa/#:~:text=Site%20overview-,The%20Pisces%20Reef%20Complex%20is%20located%20in%20the%20western%20Irish,boulder%2Ddominated%20stony%20reef%20protrude.",Recovered/Recovering,,1,1,,Northern Ireland offshore,,,UK0030379,,Reefs,1/9/2017,-,Y,-,-,-,-,-,-,-
266,Treshnish Isles,SAC,https://sitelink.nature.scot/site/8398,,Recovered/Recovering,,2,1,,Scotland inshore,,,UK0030289,,Grey seal (Halichoerus grypus); Reefs,17/03/2005; 17/03/2005,-; -,Y; Y,-; -,-; -,-; -,-; -,-; -,-; -,-; -
267,Braemar Pockmarks,SAC,https://data.jncc.gov.uk/data/a64415df-0ef0-4a45-84d1-2ed548f70557/BraemarPockmarks-4-ConservationStatements-V1.0.pdf,https://data.jncc.gov.uk/data/a64415df-0ef0-4a45-84d1-2ed548f70557/BraemarPockmarks-4-ConservationStatements-V1.0.pdf,Degraded/Degrading,* Noting it is not considered feasible to restore some of the feature's attributes,1,,,Scotland offshore,,,UK0030357,,Submarine structures made by leaking gases,00/09/2018,-,Y,-,-,-,-,-,-,-
268,Braunton Burrows,SAC,,http://publications.naturalengland.org.uk/publication/5092780342771712,Condition_Unknown,,1,,,England inshore,,,UK0012570,,H2120 Shifting dunes along the shoreline with Ammophila arenaria ('White dunes'); H2130 Fixed dunes with herbaceous vegetation ('Grey dunes'); H2170 Dunes with Salix repens ssp. Argentea (Salicion arenariae); H2190 Humid dune slacks; H1140 Mudflats and sandflats not covered by seawater at low tide; S1395 Petalwort (Petalophyllum ralfsii),00/04/2005; 00/04/2005; 00/04/2005; 00/04/2005; 00/04/2005; 00/04/2005,-; -; -; -; -; -,N; N; N; N; N; N,-; -; -; -; -; -,-; -; -; -; -; -,-; -; -; -; -; -,-; -; -; -; -; -,-; -; -; -; -; -,-; -; -; -; -; -,-; -; -; -; -; -
269,Faray and Holm of Faray,SAC,https://sitelink.nature.scot/site/8254,,Degraded/Degrading,,1,,,Scotland inshore,,,UK0017096,,Grey seal (Halichoerus grypus),17/03/2005,-,Y,-,-,-,-,-,-,-
270,Loch of Stenness,SAC,https://sitelink.nature.scot/site/8303,,Recovered/Recovering,,1,1,,Scotland inshore,,,UK0014749,,Lagoons,17/03/2005,-,Y,-,-,-,-,-,-,-
271,Glen Beasdale,SAC,https://sitelink.nature.scot/site/8263,,Recovered/Recovering,,1,1,,Scotland inshore,,,UK0030154,,Freshwater pearl mussel (Margaritifera margaritifera); Otter (Lutra lutra); Western acidic oak woodland,17/03/2005; 17/03/2005; 17/03/2005,-; -; -,Y; Y; Y,-; -; -,-; -; -,-; -; -,-; -; -,-; -; -,-; -; -,-; -; -
272,Monach Islands,SAC,https://sitelink.nature.scot/site/8322,,Recovered/Recovering,"* Note, if non-marine component features were included, this would be Mixed Picture.",1,1,,Scotland inshore,,,UK0012694,,Dune grassland; Grey seal (Halichoerus grypus); Machair; Shifting dunes with marram,17/03/2005; 17/03/2005; 17/03/2005; 17/03/2005,-; -; -; -,Y; Y; Y; Y,-; -; -; -,-; -; -; -,-; -; -; -,-; -; -; -,-; -; -; -,-; -; -; -,-; -; -; -
273,Mousa,SAC,https://sitelink.nature.scot/site/8333,,Mixed_Picture,,3,0.6666,,Scotland inshore,,,UK0012711,,,,,,,,,,,,
274,Kenfig/ Cynffig,SAC,https://cdn.cyfoethnaturiol.cymru/ai1oiagf/condition-assessments-for-atlantic-salt-meadows-and-salicornia-in-welsh-sacs.pdf,https://naturalresources.wales/media/672610/Kenfig%20SAC%20management%20plan%2021.4.08%20English.pdf,Recovered/Recovering,,1,1,,Wales inshore,,,UK0012566,,H2130 Fixed dunes with herbaceous vegetation (grey dunes); H2170 Dunes with Salix repens ssp. argentea (Salicion arenariae); H2190 Humid dune slacks; H3140 Hard oligo-mesotrophic waters with benthic vegetation of Chara spp.; S1395 Petalwort (Petalophyllum ralfsii); S1903 Fen orchid (Liparis loeseli); Atlantic salt meadows (Glauco-Puccinellietalia maritimae),01/12/2004; 01/12/2004; 01/12/2004; 01/12/2004; 01/12/2004; 01/12/2004; 01/12/2004,-; -; -; -; -; -; -,Y; Y; Y; Y; Y; Y; Y,-; -; -; -; -; -; -,-; -; -; -; -; -; -,-; -; -; -; -; -; -,-; -; -; -; -; -; -,-; -; -; -; -; -; -,-; -; -; -; -; -; -,-; -; -; -; -; -; -
275,Moine Mhor,SAC,https://sitelink.nature.scot/site/8319,,Recovered/Recovering,,3,1,,Scotland inshore,,,UK0019839,,Active raised bog; Atlantic salt meadows; Degraded raised bog; Intertidal mudflats and sandflats; Marsh fritillary butterfly (Euphydryas aurinia); Otter (Lutra lutra); Western acidic oak woodland,17/03/2005; 17/03/2005; 17/03/2005; 17/03/2005; 17/03/2005; 17/03/2005; 17/03/2005,-; -; -; -; -; -; -,Y; Y; Y; Y; Y; Y; Y,-; -; -; -; -; -; -,-; -; -; -; -; -; -,-; -; -; -; -; -; -,-; -; -; -; -; -; -,-; -; -; -; -; -; -,-; -; -; -; -; -; -,-; -; -; -; -; -; -
276,Loch Creran,SAC,https://sitelink.nature.scot/site/8294,,Degraded/Degrading,,1,,,Scotland inshore,,,UK0030190,,Reefs,17/03/2005,-,Y,-,-,-,-,-,-,-
277,Drigg Coast,SAC,https://designatedsites.naturalengland.org.uk/Marine/MarineFeatureCondition.aspx?SiteCode=UK0013031&SiteName=drigg%20coast&SiteNameDisplay=Drigg+Coast+SAC&countyCode=&responsiblePerson=&SeaArea=&IFCAArea=,http://publications.naturalengland.org.uk/publication/3015031?category=3229185,Condition_Unknown,,4,,,England inshore,,,UK0013031,,H1130 Estuaries; H1140 Mudflats and sandflats not covered by seawater at low tide; H1310 Salicornia and other annuals colonising mud and sand; H1330 Atlantic salt meadows (Glauco-Puccinellietalia maritimae); H2110 Embryonic shifting dunes; H2120 Shifting dunes along the shoreline with Ammophila arenaria ('White dunes'); H2130 Fixed dunes with herbaceous vegetations ('Grey dunes'); H2150 Atlantic decalcified fixed dunes (Calluno-Ulicetea); H2170 Dune with Salix repens spp. Argentea (Salicion arenariae); H2190 Humid dune slacks,01/04/2005; 01/04/2005; 01/04/2005; 01/04/2005; 01/04/2005; 01/04/2005; 01/04/2005; 01/04/2005; 01/04/2005; 01/04/2005,-; -; -; -; -; -; -; -; -; -,N; N; N; N; N; N; N; N; N; N,-; -; -; -; -; -; -; -; -; -,-; -; -; -; -; -; -; -; -; -,-; -; -; -; -; -; -; -; -; -,-; -; -; -; -; -; -; -; -; -,-; -; -; -; -; -; -; -; -; -,-; -; -; -; -; -; -; -; -; -,-; -; -; -; -; -; -; -; -; -
278,Bassurelle Sandbank,SAC,https://data.jncc.gov.uk/data/bc151f84-8cc7-4ba1-a506-05095a2f361a/Bassurelle-4-ConservationStatements-V1.0.pdf,https://data.jncc.gov.uk/data/bc151f84-8cc7-4ba1-a506-05095a2f361a/Bassurelle-4-ConservationStatements-V1.0.pdf,Degraded/Degrading,,1,,,England offshore,,,UK0030368,,1110 Sandbanks which are slightly covered by seawater all the time,00/09/2017,-,Y,-,-,-,-,-,-,-
279,Lundy,SAC,https://designatedsites.naturalengland.org.uk/Marine/MarineFeatureCondition.aspx?SiteCode=UK0013114&SiteName=lundy&SiteNameDisplay=Lundy+SAC&countyCode=&responsiblePerson=&SeaArea=&IFCAArea=,http://publications.naturalengland.org.uk/publication/3089885?category=3229185,Mixed_Picture,,4,0.75,,England inshore,,,UK0013114,,,,,,,,,,,,
280,East Mingulay,SAC,https://sitelink.nature.scot/site/10232,https://sitelink.nature.scot/site/10232,Condition_Unknown,,1,,,Scotland inshore,,,UK0030364,,Reefs,7/2/2019,-,N,-,-,-,-,-,-,-
281,Ardvar and Loch a' Mhuilinn Woodlands,SAC,https://sitelink.nature.scot/site/8192,,Recovered/Recovering,,1,1,,Scotland inshore,,,UK0030231,,Freshwater pearl mussel (Margaritifera margaritifera); Otter (Lutra lutra); Western acidic oak woodland,17/03/2005; 17/03/2005; 17/03/2005,-; -; -,Y; Y; Y,-; -; -,-; -; -,-; -; -,-; -; -,-; -; -,-; -; -,-; -; -
282,Orfordness - Shingle Street,SAC,https://designatedsites.naturalengland.org.uk/Marine/MarineFeatureCondition.aspx?SiteCode=UK0014780&SiteName=orford&SiteNameDisplay=Orfordness+-+Shingle+Street+SAC&countyCode=&responsiblePerson=&SeaArea=&IFCAArea=,http://publications.naturalengland.org.uk/publication/2908548?category=3229185,Recovered/Recovering,,1,1,,England inshore,,,UK0014780,,H1150 Coastal lagoons; H1210 Annual vegetation of drift lines; H1220 Perennial vegetation of stony banks,01/04/2005; 01/04/2005; 01/04/2005,-; -; -,Y; N; N,100%; -; -,-; -; -,-; -; -,-; -; -,-; -; -,-; -; -,-; -; -
283,Durness,SAC,https://sitelink.nature.scot/site/8246,,Recovered/Recovering,,1,1,,Scotland inshore,,,UK0012786,,"Alpine and subalpine calcareous grasslands; Base-rich fens; Calcium-rich nutrient-poor lakes, lochs and pools; Dry heaths; Dune grassland; Humid dune slacks; Limestone pavements; Otter (Lutra lutra); Shifting dunes with marram; Tall herb communities; Wet heathland with cross-leaved heath",17/03/2005; 17/03/2005; 17/03/2005; 17/03/2005; 17/03/2005; 17/03/2005; 17/03/2005; 17/03/2005; 17/03/2005; 17/03/2005; 17/03/2005,-; -; -; -; -; -; -; -; -; -; -,Y; Y; Y; Y; Y; Y; Y; Y; Y; Y; Y,-; -; -; -; -; -; -; -; -; -; -,-; -; -; -; -; -; -; -; -; -; -,-; -; -; -; -; -; -; -; -; -; -,-; -; -; -; -; -; -; -; -; -; -,-; -; -; -; -; -; -; -; -; -; -,-; -; -; -; -; -; -; -; -; -; -,-; -; -; -; -; -; -; -; -; -; -
284,Croker Carbonate Slabs,SAC,https://data.jncc.gov.uk/data/9e4ea87b-2c3a-4b2e-9442-ff50d6fa64d1/Croker-4-ConservationStatements-V1.0.pdf,,Recovered/Recovering,,1,1,,Wales offshore,,,UK0030381,,Submarine structures made by leaking gases,5/9/2019,-,Y,-,-,-,-,-,-,-
285,Obain Loch Euphoirt,SAC,https://sitelink.nature.scot/site/8343,,Recovered/Recovering,,1,1,,Scotland inshore,,,UK0017101,,Lagoons,17/03/2005,-,Y,-,-,-,-,-,-,-
286,Eileanan agus Sgeiran Lios mor,SAC,https://sitelink.nature.scot/site/8251,,Recovered/Recovering,,1,1,,Scotland inshore,,,UK0030182,,Harbour seal (Phoca vitulina),17/03/2005,-,Y,-,-,-,-,-,-,-
287,Thanet Coast,SAC,https://designatedsites.naturalengland.org.uk/Marine/MarineFeatureCondition.aspx?SiteCode=UK0013107&SiteName=thanet&SiteNameDisplay=Thanet+Coast+SAC&countyCode=&responsiblePerson=&SeaArea=&IFCAArea=,http://publications.naturalengland.org.uk/publication/3217253?category=3229185,Recovered/Recovering,,2,0.8,,England inshore,,,UK0013107,,Blue mussel (Mytilus edulis) beds; Moderate energy circalittoral rock; Moderate energy infralittoral rock; Peat and Clay exposures; Ross worm (Sabellaria spinulosa) reefs; Stalked jellyfish (Calvadosia cruxmelitensis); Stalked jellyfish (Haliclystus spp); Subtidal chalk; Subtidal coarse sediment; Subtidal mixed sediments; Subtidal sand,12/12/2013; 12/12/2013; 12/12/2013; 12/12/2013; 12/12/2013; 12/12/2013; 31/05/2019; 12/12/2013; 12/12/2013; 12/12/2013; 12/12/2013,Maintain in favourable condition; Maintain in favourable condition; Maintain in favourable condition; Maintain in favourable condition; Recover to favourable condition; Maintain in favourable condition; Maintain in favourable condition; Maintain in favourable condition; Maintain in favourable condition; Maintain in favourable condition; Maintain in favourable condition,N; N; N; N; N; N; N; N; N; N; N,-; -; -; -; -; -; -; -; -; -; -,-; -; -; -; -; -; -; -; -; -; -,-; -; -; -; -; -; -; -; -; -; -,-; -; -; -; -; -; -; -; -; -; -,-; -; -; -; -; -; -; -; -; -; -,-; -; -; -; -; -; -; -; -; -; -,-; -; -; -; -; -; -; -; -; -; -
288,South-East Islay Skerries,SAC,https://sitelink.nature.scot/site/8381,,Recovered/Recovering,,1,1,,Scotland inshore,,,UK0030067,,Harbour seal (Phoca vitulina),17/03/2005,-,Y,-,-,-,-,-,-,-
289,Tayvallich Juniper and Coast,SAC,https://sitelink.nature.scot/site/8392,,Recovered/Recovering,,1,1,,Scotland inshore,,,UK0030287,,Juniper on heaths or calcareous grasslands; Marsh fritillary butterfly (Euphydryas aurinia); Otter (Lutra lutra),17/03/2005; 17/03/2005; 17/03/2005,-; -; -,Y; Y; Y,-; -; -,-; -; -,-; -; -,-; -; -,-; -; -,-; -; -,-; -; -
290,Flamborough Head,SAC,https://designatedsites.naturalengland.org.uk/Marine/MarineFeatureCondition.aspx?SiteCode=UK0013036&SiteName=flambor&SiteNameDisplay=Flamborough+Head+SAC&countyCode=&responsiblePerson=&SeaArea=&IFCAArea=,http://publications.naturalengland.org.uk/publication/3048908?category=3229185,Condition_Unknown,,2,,,England inshore,,,UK0013036,,H1170 Reefs; H1230 Vegetated sea cliffs of the Atlantic and Baltic coasts; H8330 Submerged or partially submerged sea caves,01/04/2005; 01/04/2005; 01/04/2005,-; -; -,N; N; N,-; -; -,-; -; -,-; -; -,-; -; -,-; -; -,-; -; -,-; -; -
291,The Maidens,SAC,https://www.daera-ni.gov.uk/publications/202324-summary-feature-condition-status,https://www.daera-ni.gov.uk/sites/default/files/publications/daera/The%20Maidens%20SAC%20Conservation%20Objectives%202017.PDF,Recovered/Recovering,,3,1,,Northern Ireland inshore,,,UK0030384,,Grey seal (Halichoerus grypus); Reefs; Sandbanks which are slightly covered by seawater all the time,00/09/2017; 00/09/2017; 00/09/2017,-; -; -,Y; Y; Y,-; -; -,-; -; -,-; -; -,-; -; -,-; -; -,-; -; -,-; -; -
292,Taynish and Knapdale Woods,SAC,https://sitelink.nature.scot/site/8391,,Recovered/Recovering,,1,1,,Scotland inshore,,,UK0012682,,Clear-water lakes or lochs with aquatic vegetation and poor to moderate nutrient levels; Marsh fritillary butterfly (Euphydryas aurinia); Otter (Lutra lutra); Western acidic oak woodland,17/03/2005; 17/03/2005; 17/03/2005; 17/03/2005,-; -; -; -,Y; Y; Y; Y,-; -; -; -,-; -; -; -,-; -; -; -,-; -; -; -,-; -; -; -,-; -; -; -,-; -; -; -
293,Chesil and the Fleet,SAC,https://designatedsites.naturalengland.org.uk/Marine/MarineFeatureCondition.aspx?SiteCode=UK0017076&SiteName=chesil&SiteNameDisplay=Chesil+and+the+Fleet+SAC&countyCode=&responsiblePerson=&SeaArea=&IFCAArea=,http://publications.naturalengland.org.uk/publication/2967759?category=3229185,Condition_Unknown,,3,,,England inshore,,,UK0017076,,H1150 Coastal lagoons; H1210 Annual vegetation of drift lines; H1220 Perennial vegetation of stony banks; H1330 Atlantic salt meadows (Glauco-Puccinellietalia maritimae); H1420 Mediterranean and thermo-Atlantic halophilous scrubs (Sarcocornetea fruticosi),01/04/2005; 01/04/2005; 01/04/2005; 01/04/2005; 01/04/2005,-; -; -; -; -,Y; N; N; N; N,19%; -; -; -; -,-; -; -; -; -,11%; -; -; -; -,70%; -; -; -; -,-; -; -; -; -,-; -; -; -; -,-; -; -; -; -
294,Shell Flat and Lune Deep,SAC,https://designatedsites.naturalengland.org.uk/Marine/MarineFeatureCondition.aspx?SiteCode=UK0030376&SiteName=shell%20flat&SiteNameDisplay=Shell+Flat+and+Lune+Deep+SAC&countyCode=&responsiblePerson=&SeaArea=&IFCAArea=,http://publications.naturalengland.org.uk/publication/3270764?category=3229185,Recovered/Recovering,,2,1,,England inshore,,,UK0030376,,H1110 Sandbanks which are slightly covered by sea water all the time; H1170 Reefs,29/09/2017; 29/09/2017,-; -,Y; Y,100%; 100%,-; -,-; -,-; -,-; -,-; -,-; -
295,Rathlin Island,SAC,https://www.daera-ni.gov.uk/publications/reasons-designation-special-area-conservation-rathlin-island,https://www.daera-ni.gov.uk/sites/default/files/publications/doe/Conservation%20Objectives%20%282017%29.%20%20Rathlin%20Island%20SAC.%20%20Version%203.1%20-%20amendment%2013.10.2017.%20PDF..PDF,Mixed_Picture,,3,0.33333,,Northern Ireland inshore,,,UK0030055,,"Guillemot (Uria aalge), breeding; Kittiwake (Rissa tridactyla), breeding; Peregrine (Falco peregrinus), breeding; Razorbill (Alca torda), breeding; Seabird assemblage",25/02/1999; 25/02/1999; 25/02/1999; 25/02/1999; 25/02/1999,-; -; -; -; -,Y; Y; Y; Y; Y,-; -; -; -; -,-; -; -; -; -,-; -; -; -; -,-; -; -; -; -,-; -; -; -; -,-; -; -; -; -,-; -; -; -; -
296,Mull Oakwoods,SAC,https://sitelink.nature.scot/site/8335,,Recovered/Recovering,,1,1,,Scotland inshore,,,UK0030219,,Otter (Lutra lutra); Western acidic oak woodland,17/03/2005; 17/03/2005,-; -,Y; Y,-; -,-; -,-; -,-; -,-; -,-; -,-; -
