OBJECTID_1,Site_Name,Designation_Type,Link_to_CA,Link_to_GMA,Traffic_Light_Colour_using_80__,Notes,Number_of_Marine_Components,Perc_in_Fav_or_Unfav_Recover,GEOGRAPHIC_LOCATION,Country,EST_DATE,STATUS,SITE_CODE,LEAD,Features,Feature_Designation_Dates,Feature_Management_Approaches,Feature_Conditions,Feature_Favourable,Feature_Unfavourable_Recovering,Feature_Unfavourable_No_Change,Feature_Unfavourable_Declining,Feature_Partially_Destroyed,Feature_Destroyed,Feature_Not_Assessed
1,Loch Sunart to the Sound of Jura ,Scottish NCMPA,https://sitelink.nature.scot/site/10418,,Recovered/Recovering,,2,,MARINE,Scotland,,Current,,SNH,Flapper skate (Dipturus intermedius); Quaternary of Scotland,07/08/2014; 07/08/2014,Conserve; Conserve,N; N,-; -,-; -,-; -,-; -,-; -,-; -,-; -
2,Wester Ross ,Scottish NCMPA,https://sitelink.nature.scot/site/10421,,Recovered/Recovering,"*Note two features with GMAs of recover, but because there's a large number of features this still makes a overall score of recover following the 80% rule - bias towards MPAs with more features",11,,MARINE,Scotland,,Current,,SNH,Subtidal coarse sediment; Subtidal sand,29/01/2016; 29/01/2016,Recover to favourable condition; Recover to favourable condition,Y; Y,-; -,-; -,-; -,-; -,-; -,-; -,-; -
3,Mousa to Boddam ,Scottish NCMPA,https://sitelink.nature.scot/site/10410,,Recovered/Recovering,,2,0.5,MARINE,Scotland,,Current,,SNH,Marine Geomorphology of the Scottish shelf seabed; Sandeels (Ammidytes marinus/Ammodytes tobianus),07/08/2014; 07/08/2014,Conserve; Conserve,N; N,-; -,-; -,-; -,-; -,-; -,-; -,-; -
5,Shiant East Bank ,Scottish NCMPA,https://sitelink.nature.scot/site/10475,https://www.nature.scot/sites/default/files/2019-06/Shiant%20East%20Bank%20possible%20MPA%20-%20Conservation%20and%20Management%20Advice.pdf,Recovered/Recovering,,4,1,MARINE,Scotland,,Current,,SNH,Circalittoral sands and mixed sediment communities; Northern sea fan and sponge communities; Quaternary of Scotland; Shelf banks and mounds,17/12/2020; 17/12/2020; 17/12/2020; 17/12/2020,Conserve; Conserve; Conserve; Conserve,Y; Y; Y; Y,-; -; -; -,-; -; -; -,-; -; -; -,-; -; -; -,-; -; -; -,-; -; -; -,-; -; -; -
6,Loch Sunart ,Scottish NCMPA,https://sitelink.nature.scot/site/10417,,Recovered/Recovering,,3,,MARINE,Scotland,,Current,,SNH,Lagoons,17/03/2005,-,Y,-,-,-,-,-,-,-
7,Clyde Sea Sill ,Scottish NCMPA,https://sitelink.nature.scot/site/10414,,Mixed_Picture,,4,0.75,MARINE,Scotland,,Current,,SNH,Black guillemot (Cepphus grylle); Fronts; Marine geomorphology of the Scottish shelf seabed; Circalittoral and offshore sand and coarse sediment communities,07/08/2014; 07/08/2014; 07/08/2014; 07/08/2014,Recover; Conserve; Conserve; Conserve,N; N; N; N,-; -; -; -,-; -; -; -,-; -; -; -,-; -; -; -,-; -; -; -,-; -; -; -,-; -; -; -
8,Small Isle ,Scottish NCMPA,https://sitelink.nature.scot/site/10422,,Mixed_Picture,,10,,MARINE,Scotland,,Current,,SNH,,,,,,,,,,,
9,Sea of the Hebrides ,Scottish NCMPA,https://www.nature.scot/sites/default/files/2019-06/Sea%20of%20the%20Hebrides%20possible%20MPA%20-%20Conservation%20and%20Management%20Advice_0.pdf,https://sitelink.nature.scot/site/10474,Recovered/Recovering,,4,1,MARINE,Scotland,,Current,,SNH,"Black-throated diver (Gavia arctica), non-breeding; Eider (Somateria mollissima), non-breeding; Great northern diver (Gavia immer), non-breeding; Long-tailed duck (Clangula hyemalis), non-breeding; Red-breasted merganser (Mergus serrator), non-breeding; Red-throated diver (Gavia stellata), breeding; Slavonian grebe (Podiceps auritus), non-breeding",03/12/2020; 03/12/2020; 03/12/2020; 03/12/2020; 03/12/2020; 03/12/2020; 03/12/2020,-; -; -; -; -; -; -,Y; Y; Y; Y; Y; Y; Y,-; -; -; -; -; -; -,-; -; -; -; -; -; -,-; -; -; -; -; -; -,-; -; -; -; -; -; -,-; -; -; -; -; -; -,-; -; -; -; -; -; -,-; -; -; -; -; -; -
10,"Lochs Duich, Long and Alsh ",Scottish NCMPA,https://sitelink.nature.scot/site/10416,,Recovered/Recovering,,2,,MARINE,Scotland,,Current,,SNH,Reefs,17/03/2005,-,Y,-,-,-,-,-,-,-
11,Loch Carron ,Scottish NCMPA,https://sitelink.nature.scot/site/10543,,Mixed_Picture,,2,,MARINE,Scotland,,Current,,SNH,Reefs,17/03/2005,-,Y,-,-,-,-,-,-,-
12,Fetlar to Haroldswick ,Scottish NCMPA,https://sitelink.nature.scot/site/10409,,Recovered/Recovering,,7,0.857142,MARINE,Scotland,,Current,,SNH,Black guillemot (Cepphus grylle); Circalittoral sand and coarse sediment communities; Horse mussel beds; Kelp and seaweed communities on sublittoral sediment; Maerl beds; Marine Geomorphology of the Scottish shelf seabed; Shallow tide-swept coarse sands with burrowing bivalves,18/11/2016; 18/11/2016; 18/11/2016; 18/11/2016; 18/11/2016; 18/11/2016; 18/11/2016,Recover; Conserve; Conserve; Conserve; Conserve; Conserve; Conserve,Y; Y; Y; Y; Y; Y; Y,-; -; -; -; -; -; -,-; -; -; -; -; -; -,-; -; -; -; -; -; -,-; -; -; -; -; -; -,-; -; -; -; -; -; -,-; -; -; -; -; -; -,-; -; -; -; -; -; -
13,Papa Westray ,Scottish NCMPA,https://sitelink.nature.scot/site/10412,,Recovered/Recovering,,2,1,MARINE,Scotland,,Current,,SNH,Coastal Saltmarshes and Saline Reedbeds; Esturine Rocky Habitats; Intertidal Coarse Sediment; Intertidal Mixed Sediments; Intertidal Mud,31/05/2019; 31/05/2019; 31/05/2019; 31/05/2019; 31/05/2019,Maintain in favourable condition; Maintain in favourable condition; Maintain in favourable condition; Maintain in favourable condition; Maintain in favourable condition,N; N; N; N; N,-; -; -; -; -,-; -; -; -; -,-; -; -; -; -,-; -; -; -; -,-; -; -; -; -,-; -; -; -; -,-; -; -; -; -
14,Loch Sween ,Scottish NCMPA,https://sitelink.nature.scot/site/10419,,Recovered/Recovering,,4,,MARINE,Scotland,,Current,,SNH,Reefs; Shallow inlets and bays,17/03/2005; 17/03/2005,-; -,Y; Y,-; -,-; -,-; -,-; -,-; -,-; -,-; -
15,Monach Isles ,Scottish NCMPA,https://sitelink.nature.scot/site/10420,,Mixed_Picture,,3,0.66666,MARINE,Scotland,,Current,,SNH,Dune grassland; Grey seal (Halichoerus grypus); Machair; Shifting dunes with marram,17/03/2005; 17/03/2005; 17/03/2005; 17/03/2005,-; -; -; -,Y; Y; Y; Y,-; -; -; -,-; -; -; -,-; -; -; -,-; -; -; -,-; -; -; -,-; -; -; -,-; -; -; -
16,Red Rocks and Longay ,Scottish NCMPA,https://sitelink.nature.scot/site/10594,https://sitelink.nature.scot/site/10594,Recovered/Recovering,,2,1,MARINE,Scotland,,Current,,SNH,"Flapper skate (Dipturus intermedius); Quaternary of Scotland - moraines, crag and tails, rock drumlin",10/03/2021; 09/02/2023,Conserve; Conserve,Y; Y,-; -,-; -,-; -,-; -,-; -,-; -,-; -
17,Loch Creran ,Scottish NCMPA,https://sitelink.nature.scot/site/10415,,Recovered/Recovering,,2,1,MARINE,Scotland,,Current,,SNH,Reefs,17/03/2005,-,Y,-,-,-,-,-,-,-
18,Noss Head ,Scottish NCMPA,https://sitelink.nature.scot/site/10411,,Recovered/Recovering,,1,1,MARINE,Scotland,,Current,,SNH,"Fulmar (Fulmarus glacialis), breeding; Gannet (Morus bassanus), breeding; Great skua (Stercorarius skua), breeding; Guillemot (Uria aalge), breeding; Kittiwake (Rissa tridactyla), breeding; Puffin (Fratercula arctica), breeding; Seabird, assemblage, breeding",16/08/1996; 16/08/1996; 16/08/1996; 16/08/1996; 16/08/1996; 16/08/1996; 16/08/1996,-; -; -; -; -; -; -,Y; Y; Y; Y; Y; Y; Y,-; -; -; -; -; -; -,-; -; -; -; -; -; -,-; -; -; -; -; -; -,-; -; -; -; -; -; -,-; -; -; -; -; -; -,-; -; -; -; -; -; -,-; -; -; -; -; -; -
19,Wyre and Rousay Sounds ,Scottish NCMPA,https://sitelink.nature.scot/site/10413,,Recovered/Recovering,,3,1,MARINE,Scotland,,Current,,SNH,Kelp and seaweed communities on sublittoral sediment; Maerl beds; Marine geomorphology of the Scottish shelf seabed,07/08/2014; 07/08/2014; 07/08/2014,Conserve; Conserve; Conserve,N; N; N,-; -; -,-; -; -,-; -; -,-; -; -,-; -; -,-; -; -,-; -; -
20,Southern Trench ,Scottish NCMPA,https://sitelink.nature.scot/site/10477,,Recovered/Recovering,,6,1,MARINE,Scotland,,Current,,SNH,Burrowed mud; Fronts; Minke whale (Balaenoptrea acutorostrata); Quaternary of Scotland; Shelf deeps; Submarine Mass Movement,17/12/2020; 17/12/2020; 17/12/2020; 17/12/2020; 17/12/2020; 17/12/2020,Conserve; Conserve; Conserve; Conserve; Conserve; Conserve,N; N; N; N; N; N,-; -; -; -; -; -,-; -; -; -; -; -,-; -; -; -; -; -,-; -; -; -; -; -,-; -; -; -; -; -,-; -; -; -; -; -,-; -; -; -; -; -
21,East Caithness Cliffs ,Scottish NCMPA,https://sitelink.nature.scot/site/10408,,Degraded/Degrading,,1,,MARINE,Scotland,,Current,,SNH,"Cormorant (Phalacrocorax carbo), breeding; Fulmar (Fulmarus glacialis), breeding; Great black-backed gull (Larus marinus), breeding; Guillemot (Uria aalge), breeding; Herring gull (Larus argentatus), breeding; Kittiwake (Rissa tridactyla), breeding; Peregrine (Falco peregrinus), breeding; Razorbill (Alca torda), breeding; Seabird assemblage, breeding; Shag (Phalacrocorax aristotelis), breeding",27/03/1996; 27/03/1996; 27/03/1996; 27/03/1996; 27/03/1996; 27/03/1996; 27/03/1996; 27/03/1996; 27/03/1996; 27/03/1996,-; -; -; -; -; -; -; -; -; -,Y; Y; Y; Y; Y; Y; Y; Y; Y; Y,-; -; -; -; -; -; -; -; -; -,-; -; -; -; -; -; -; -; -; -,-; -; -; -; -; -; -; -; -; -,-; -; -; -; -; -; -; -; -; -,-; -; -; -; -; -; -; -; -; -,-; -; -; -; -; -; -; -; -; -,-; -; -; -; -; -; -; -; -; -
22,South Arran ,Scottish NCMPA,https://sitelink.nature.scot/site/10423,,Recovered/Recovering,,7,,MARINE,Scotland,,Current,,SNH,"Black-tailed godwit (Limosa limosa islandica), A616, nb; Dark-bellied brent goose (Branta bernicla bernicla), A675, nb; Dunlin (Calidris alpina alpina), A672, nb; Red-breasted merganser (Mergus serrator), A069, nb",28/02/1995; 28/02/1995; 28/02/1995; 28/02/1995,-; -; -; -,Y; Y; Y; Y,-; -; -; -,100%; -; -; -,-; 100%; -; -,-; -; 100%; 100%,-; -; -; -,-; -; -; -,-; -; -; -
23,Upper Loch Fyne and Loch Goil ,Scottish NCMPA,https://sitelink.nature.scot/site/10424,,Recovered/Recovering,,5,,MARINE,Scotland,,Current,,SNH,Burrowed mud; Flameshell beds; Horse mussel beds; Ocean quahog aggregations (Arctica islandica); Sublittoral mud and specific mixed sediment communities,07/08/2014; 07/08/2014; 07/08/2014; 07/08/2014; 07/08/2014,Conserve; Recover; Conserve; Conserve; Conserve,N; N; N; N; N,-; -; -; -; -,-; -; -; -; -,-; -; -; -; -,-; -; -; -; -,-; -; -; -; -,-; -; -; -; -,-; -; -; -; -
25,Central Fladen ,Scottish NCMPA,https://data.jncc.gov.uk/data/7a3bf598-1025-4197-a0c9-b4f5af9e5805/CentralFladen-4-ConservationStatements-V1.0.pdf,https://data.jncc.gov.uk/data/7a3bf598-1025-4197-a0c9-b4f5af9e5805/CentralFladen-4-ConservationStatements-V1.0.pdf,Mixed_Picture,,2,0.5,MARINE,Scotland,,Current,,JNCC,Burrowed mud; Sub-glacial tunnel valley representative of the Fladen Deeps Key Geodiversity Area,07/08/2014; 07/08/2014,Recover to favourable condition; Maintain in favourable condition,Y; Y,-; -,-; -,-; -,-; -,-; -,-; -,-; -
26,Turbot Bank ,Scottish NCMPA,https://data.jncc.gov.uk/data/63f05a50-a78b-4a58-9bde-d78261780729/TurbotBank-4-ConservationStatements-V1.0.pdf,,Recovered/Recovering,,1,1,MARINE,Scotland,,Current,,JNCC,Sandeels,7/8/2014,-,Y,-,-,-,-,-,-,-
27,West Shetland Shelf,Scottish NCMPA,https://data.jncc.gov.uk/data/99949625-27d3-4ef5-88ca-9c0f2e3f605b/WSS-4-ConservationStatements-v1.0.pdf,,Recovered/Recovering,,1,1,MARINE,Scotland,,Current,,JNCC,Offshore subtidal sands and gravels,7/8/2014,-,Y,-,-,-,-,-,-,-
28,Hatton-Rockall Basin ,Scottish NCMPA,https://data.jncc.gov.uk/data/510d000b-bff5-4031-836f-e4cc223a57d7/HRB-4-ConservationStatements-V1.0.pdf,https://data.jncc.gov.uk/data/510d000b-bff5-4031-836f-e4cc223a57d7/HRB-4-ConservationStatements-V1.0.pdf,Condition_Unknown,,3,,MARINE,Scotland,,Current,,JNCC,Deep-sea sponge aggregations; Offshore deep-sea muds; Sediment drifts and polygonal fault systems representative of the Hatton Bank (and adjacent seafloor) key geodiversity area,07/08/2014; 07/08/2014; 07/08/2014,-; -; -,Y; Y; Y,-; -; -,-; -; -,-; -; -,-; -; -,-; -; -,-; -; -,-; -; -
29,North-west Orkney ,Scottish NCMPA,https://data.jncc.gov.uk/data/10f3ad34-f1f8-4f12-b2ab-17e73f55cc60/NWO-4-ConservationStatements-V1.0.pdf,,Recovered/Recovering,,2,1,MARINE,Scotland,,Current,,JNCC,Subtidal coarse sediment,31/05/2019,Recover to favourable condition,N,-,-,-,-,-,-,-
30,Norwegian Boundary Sediment Plain ,Scottish NCMPA,https://data.jncc.gov.uk/data/bf2a3807-c9f1-4195-8cc3-b46f68961304/NBSP-4-ConservationStatements-V1.0.pdf,https://data.jncc.gov.uk/data/bf2a3807-c9f1-4195-8cc3-b46f68961304/NBSP-4-ConservationStatements-V1.0.pdf,Degraded/Degrading,,1,,MARINE,Scotland,,Current,,JNCC,Ocean quahog aggregations (including sands and gravels as their supporting habitat),7/8/2014,Recover to favourable condition,Y,-,-,-,-,-,-,-
31,Firth of Forth Banks Complex ,Scottish NCMPA,https://data.jncc.gov.uk/data/92fb7e5e-5e68-4e66-bde3-afd9c27d6b14/FFBC-4-ConservationStatements-v1.0.pdf,https://data.jncc.gov.uk/data/92fb7e5e-5e68-4e66-bde3-afd9c27d6b14/FFBC-4-ConservationStatements-v1.0.pdf,Mixed_Picture,,4,0.5,MARINE,Scotland,,Current,,JNCC,Ocean quahog aggregations (Arctica islandica); Offshore subtidal sands and gravels; Shelf banks and mounds large-scale feature; Wee Bankie key geodiversity area,07/08/2014; 07/08/2014; 07/08/2014; 07/08/2014,Recover to favourable condition; Recover to favourable condition; Conserve; Conserve,Y; Y; Y; Y,-; -; -; -,-; -; -; -,-; -; -; -,-; -; -; -,-; -; -; -,-; -; -; -,-; -; -; -
32,East of Gannet and Montrose Fields ,Scottish NCMPA,https://data.jncc.gov.uk/data/7d1e751a-e082-405b-aad9-51eeaf53dd67/egmf-conservation-statements-v2-0.pdf,https://data.jncc.gov.uk/data/7d1e751a-e082-405b-aad9-51eeaf53dd67/egmf-conservation-statements-v2-0.pdf,Degraded/Degrading,,2,,MARINE,Scotland,,Current,,JNCC,Ocean quahog aggregations (including sands and gravels as their supporting habitat); Offshore deep-sea muds,07/08/2014; 07/08/2014,Recover to favourable condition; Recover to favourable condition,Y; Y,-; -,-; -,-; -,-; -,-; -,-; -,-; -
33,Erme Estuary ,MCZ,https://designatedsites.naturalengland.org.uk/Marine/MarineSiteDetail.aspx?SiteCode=UKMCZ0059&SiteName=&SiteNameDisplay=Erme%20Estuary%20MCZ&countyCode=&responsiblePe,https://assets.publishing.service.gov.uk/government/uploads/system/uploads/attachment_data/file/914618/mcz-erme-estuary-2019.pdf,Recovered/Recovering,,8,,,England,,Designated,,,Coastal Saltmarshes and Saline Reedbeds; Esturine Rocky Habitats; Intertidal Coarse Sediment; Intertidal Mixed Sediments; Intertidal Mud,31/05/2019; 31/05/2019; 31/05/2019; 31/05/2019; 31/05/2019,Maintain in favourable condition; Maintain in favourable condition; Maintain in favourable condition; Maintain in favourable condition; Maintain in favourable condition,N; N; N; N; N,-; -; -; -; -,-; -; -; -; -,-; -; -; -; -,-; -; -; -; -,-; -; -; -; -,-; -; -; -; -,-; -; -; -; -
34,Morte Platform ,MCZ,https://designatedsites.naturalengland.org.uk/Marine/MarineFeatureCondition.aspx?SiteCode=UKMCZ0063&SiteName=&SiteNameDisplay=Morte+Platform+MCZ&countyCode=&responsiblePerson=&SeaArea=&IFCAArea=  Natural England is currently in th,https://assets.publishing.service.gov.uk/government/uploads/system/uploads/attachment_data/file/915649/mcz-morte-platform-2019.pdf,Degraded/Degrading,,3,,,England,,Designated,,,High energy circalittoral rock; Moderate energy circalittoral rock; Subtidal coarse sediment,31/05/2019; 31/05/2019; 31/05/2019,Recover to favourable condition; Recover to favourable condition; Recover to favourable condition,N; N; N,-; -; -,-; -; -,-; -; -,-; -; -,-; -; -,-; -; -,-; -; -
35,Solway Firth ,MCZ,https://designatedsites.naturalengland.org.uk/Marine/MarineSiteDetail.aspx?SiteCode=UKMCZ0069&SiteName=&SiteNameDisplay=Solway%20Firth%20MCZ&countyCode=&responsiblePe,https://assets.publishing.service.gov.uk/government/uploads/system/uploads/attachment_data/file/915681/mcz-solway-firth-2019.pdf,Degraded/Degrading,,1,,,England,,Designated,,,"Bar-tailed godwit (Limosa lapponica), non-breeding; Curlew (Numenius arquata), non-breeding; Golden plover (Pluvialis apricaria), non-breeding; Knot (Calidris canutus), non-breeding; Oystercatcher (Haematopus ostralegus), non-breeding; Pink-footed goose (Anser brachyrhynchus), non-breeding; Pintail (Anas acuta), non-breeding; Redshank (Tringa totanus), non-breeding; Red-throated diver (Gavia stellata), non-breeding; Ringed plover (Charadrius hiaticula), concentration; Greater scaup (Aythya marila), non-breeding; Barnacle goose (Branta leucopsis), non-breeding; Waterbird assemblage, non-breeding; Black-headed gull (Larsus ridibundus), non-breeding; Common gull (Larus canus), non-breeding; Black (common) scoter (Melanitta nigra), non-breeding; Cormorant (Phalacrocorax carbo), non-breeding; Dunlin (Calidris alpina alpina), non-breeding; Goldeneye (Bucephala clangula), non-breeding; Goosander (Mergus merganser), non-breeding; Grey plover (Pluvialis squatarola), non-breeding; Herring gull (Larus argentatus), non-breeding; Lapwing (Vanellus vanellus), non-breeding; Sanderling (Calidris alba), non-breeding; Shelduck (Tadorna tadorna), non-breeding; Shoveler (Anas clypeata), non-breeding; Teal (Anas crecca), non-breeding; Ruddy turnstone (Arenaria interpres), non-breeding; Whooper swan (Cygnus cygnus), non-breeding",03/12/2020; 03/12/2020; 03/12/2020; 03/12/2020; 03/12/2020; 03/12/2020; 03/12/2020; 03/12/2020; 03/12/2020; 03/12/2020; 03/12/2020; 03/12/2020; 03/12/2020; 03/12/2020; 03/12/2020; 03/12/2020; 03/12/2020; 03/12/2020; 03/12/2020; 03/12/2020; 03/12/2020; 03/12/2020; 03/12/2020; 03/12/2020; 03/12/2020; 03/12/2020; 03/12/2020; 03/12/2020; 03/12/2020,-; -; -; -; -; -; -; -; -; -; -; -; -; -; -; -; -; -; -; -; -; -; -; -; -; -; -; -; -,Y; Y; Y; Y; Y; Y; Y; Y; Y; Y; Y; Y; Y; Y; Y; Y; Y; Y; Y; Y; Y; Y; Y; Y; Y; Y; Y; Y; Y,-; -; -; -; -; -; -; -; -; -; -; -; -; -; -; -; -; -; -; -; -; -; -; -; -; -; -; -; -,-; -; -; -; -; -; -; -; -; -; -; -; -; -; -; -; -; -; -; -; -; -; -; -; -; -; -; -; -,-; -; -; -; -; -; -; -; -; -; -; -; -; -; -; -; -; -; -; -; -; -; -; -; -; -; -; -; -,-; -; -; -; -; -; -; -; -; -; -; -; -; -; -; -; -; -; -; -; -; -; -; -; -; -; -; -; -,-; -; -; -; -; -; -; -; -; -; -; -; -; -; -; -; -; -; -; -; -; -; -; -; -; -; -; -; -,-; -; -; -; -; -; -; -; -; -; -; -; -; -; -; -; -; -; -; -; -; -; -; -; -; -; -; -; -,-; -; -; -; -; -; -; -; -; -; -; -; -; -; -; -; -; -; -; -; -; -; -; -; -; -; -; -; -
36,Orford Inshore ,MCZ,https://designatedsites.naturalengland.org.uk/Marine/MarineSiteDetail.aspx?SiteCode=UKMCZ0081&SiteName=&SiteNameDisplay=Orford%20Inshore%20MCZ&countyCode=&responsible,https://assets.publishing.service.gov.uk/government/uploads/system/uploads/attachment_data/file/915656/mcz-orford-inshore-2019.pdf,Degraded/Degrading,,1,,,England,,Designated,,,Subtidal mixed sediments,31/05/2019,Recover to favourable condition,N,-,-,-,-,-,-,-
37,Holderness Inshore ,MCZ,https://designatedsites.naturalengland.org.uk/Marine/MarineFeatureCondition.aspx?SiteCode=UKMCZ0035&SiteName=holderness&SiteNameDisplay=Holderness+Inshore+MCZ&countyCode=&responsiblePerson=&SeaArea=&IFCAArea=,https://assets.publishing.service.gov.uk/government/uploads/system/uploads/attachment_data/file/492320/mcz-holderness-factsheet.pdf,Recovered/Recovering,,8,,,England,,Designated,,,High enery circalittoral rock; Intertidal sand and muddy sand; Moderate energy circalittoral rock; Spurn Head (Subtidal); Subtidal coarse sediment; Subtidal mixed sediments; Subtidal mud; Subtidal sand,29/01/2016; 29/01/2016; 29/01/2016; 29/01/2016; 29/01/2016; 29/01/2016; 29/01/2016; 29/01/2016,Maintain in favourable condition; Maintain in favourable condition; Maintain in favourable condition; Maintain in favourable condition; Maintain in favourable condition; Maintain in favourable condition; Maintain in favourable condition; Maintain in favourable condition,N; N; N; N; N; N; N; N,-; -; -; -; -; -; -; -,-; -; -; -; -; -; -; -,-; -; -; -; -; -; -; -,-; -; -; -; -; -; -; -,-; -; -; -; -; -; -; -,-; -; -; -; -; -; -; -,-; -; -; -; -; -; -; -
38,Cromer Shoal Chalk Beds ,MCZ,https://designatedsites.naturalengland.org.uk/Marine/MarineFeatureCondition.aspx?SiteCode=UKMCZ0031&SiteName=cromer&SiteNameDisplay=Cromer+Shoal+Chalk+Beds+MCZ&countyCode=&responsiblePerson=&SeaArea=&IFCAArea=,https://assets.publishing.service.gov.uk/government/uploads/system/uploads/attachment_data/file/492323/mcz-cromer-shoal-chalk-beds-factsheet.pdf,Degraded/Degrading,"**This MPA was automatically categorised as Unknown following our 80% rule MPA Recovery Assessment Methodology, due to 60% of the MPA's features being reported as not assessed. However, we have changed this to Degraded/Degrading based on local knowledge of the condition of this site and Natural England's supplementary conservation advice which states designated features have been lost due to the impacts of developments (please see the individual feature notes for details).",10,,,England,,Designated,,,High energy circalittoral rock; High energy infralittoral rock; Moderate energy circalittoral rock; Moderate energy infralittoral rock; North Norfolk Coast assemblage of subtidal sediment features and habitats; Peat and clay exposures; Subtidal chalk; Subtidal coarse sediment; Subtidal mixed sediments; Subtidal sand,29/01/2016; 29/01/2016; 29/01/2016; 29/01/2016; 29/01/2016; 29/01/2016; 29/01/2016; 29/01/2016; 29/01/2016; 29/01/2016,-; -; -; -; Maintain in favourable condition; -; -; -; -; -,Y; Y; Y; Y; N; Y; Y; Y; Y; Y,-; -; -; -; -; -; -; -; -; -,-; -; -; -; -; -; -; -; -; -,-; -; -; -; -; -; 100%; 100%; 100%; -,-; -; -; -; -; -; -; -; -; -,-; -; -; -; -; -; -; -; -; -,-; -; -; -; -; -; -; -; -; -,100%; 100%; 100%; 100%; -; 100%; -; -; -; 100%
39,Farnes East ,MCZ,https://jncc.gov.uk/our-work/farnes-east-mpa/#monitoring,https://assets.publishing.service.gov.uk/government/uploads/system/uploads/attachment_data/file/492371/mcz-farnes-east-factsheet.pdf,Mixed_Picture,,7,,,England,,Designated,,,Subtidal mud; Subtidal sand,29/01/2016; 12/12/2013,Maintain in favourable condition; Maintain in favourable condition,Y; Y,100%; 100%,-; -,-; -,-; -,-; -,-; -,-; -
40,Fulmar ,MCZ,https://data.jncc.gov.uk/data/1fb8f79b-6bc8-4627-ad62-6cbd7666070d/Fulmar-4-Statements-v1.0.pdf,https://assets.publishing.service.gov.uk/government/uploads/system/uploads/attachment_data/file/492376/mcz-fulmar-factsheet.pdf,Recovered/Recovering,,4,1,,England,,Designated,,,Ocean quahog (Arctica islandica); Subtidal mixed sediments; Subtidal mud; Subtidal sand,17/01/2016; 17/01/2016; 17/01/2016; 17/01/2016,Maintain in favourable condition; Maintain in favourable condition; Maintain in favourable condition; Maintain in favourable condition,Y; Y; Y; Y,-; -; -; -,-; -; -; -,-; -; -; -,-; -; -; -,-; -; -; -,-; -; -; -,-; -; -; -
41,Offshore Brighton ,MCZ,https://data.jncc.gov.uk/data/c8852181-a0ab-4266-bcf6-62d44061a170/OffshoreBrighton-4-ConservationStatements-V1.0.pdf,https://assets.publishing.service.gov.uk/government/uploads/system/uploads/attachment_data/file/492442/mcz-offshore-brighton-factsheet.pdf,Degraded/Degrading,,3,,,England,,Designated,,,High energy circalittoral rock; Subtidal coarse sediments; Subtidal mixed sediments,17/01/2016; 17/01/2016; 17/01/2016,Recover to favourable condition; Recover to favourable condition; Recover to favourable condition,Y; Y; Y,-; -; -,-; -; -,-; -; -,-; -; -,-; -; -,-; -; -,-; -; -
42,Western Channel ,MCZ,https://data.jncc.gov.uk/data/c2eed00c-be7b-4598-b56e-9d0fdceed6c5/western-channel-4-conservation-statements-v1.0.pdf,https://assets.publishing.service.gov.uk/government/uploads/system/uploads/attachment_data/file/492474/mcz-western-channel-factsheet.pdf,Degraded/Degrading,,2,,,England,,Designated,,,Subtidal coarse sediment; Subtidal sand,29/01/2016; 29/01/2016,Recover to favourable condition; Recover to favourable condition,Y; Y,-; -,-; -,-; -,-; -,-; -,-; -,-; -
43,North-West of Jones Bank ,MCZ,https://data.jncc.gov.uk/data/3a2fe0e6-ac24-437b-b32e-7e96d96c9a91/NWJB-4-ConservationStatements-v1.0.pdf,https://assets.publishing.service.gov.uk/government/uploads/system/uploads/attachment_data/file/492439/mcz-north-west-jones-bank-factsheet.pdf,Degraded/Degrading,,5,,,England,,Designated,,,Sea-pen and burrowing megafauna communites; Subtidal coarse sediments; Subtidal mixed sediments; Subtidal mud; Subtidal sand,29/01/2016; 29/01/2016; 29/01/2016; 29/01/2016; 29/01/2016,Recover to favourable condition; Recover to favourable condition; Recover to favourable condition; Recover to favourable condition; Recover to favourable condition,Y; Y; Y; Y; Y,-; -; -; -; -,-; -; -; -; -,-; -; -; -; -,-; -; -; -; -,-; -; -; -; -,-; -; -; -; -,-; -; -; -; -
44,Thanet Coast ,MCZ,https://designatedsites.naturalengland.org.uk/Marine/MarineFeatureCondition.aspx?SiteCode=UKMCZ0017&SiteName=thanet&SiteNameDisplay=Thanet+Coast+MCZ&countyCode=&responsiblePerson=&SeaArea=&IFCAArea=,https://assets.publishing.service.gov.uk/government/uploads/system/uploads/attachment_data/file/915355/mcz-thanet-coast-2019.pdf,Recovered/Recovering,,11,,,England,,Designated,,,Blue mussel (Mytilus edulis) beds; Moderate energy circalittoral rock; Moderate energy infralittoral rock; Peat and Clay exposures; Ross worm (Sabellaria spinulosa) reefs; Stalked jellyfish (Calvadosia cruxmelitensis); Stalked jellyfish (Haliclystus spp); Subtidal chalk; Subtidal coarse sediment; Subtidal mixed sediments; Subtidal sand,12/12/2013; 12/12/2013; 12/12/2013; 12/12/2013; 12/12/2013; 12/12/2013; 31/05/2019; 12/12/2013; 12/12/2013; 12/12/2013; 12/12/2013,Maintain in favourable condition; Maintain in favourable condition; Maintain in favourable condition; Maintain in favourable condition; Recover to favourable condition; Maintain in favourable condition; Maintain in favourable condition; Maintain in favourable condition; Maintain in favourable condition; Maintain in favourable condition; Maintain in favourable condition,N; N; N; N; N; N; N; N; N; N; N,-; -; -; -; -; -; -; -; -; -; -,-; -; -; -; -; -; -; -; -; -; -,-; -; -; -; -; -; -; -; -; -; -,-; -; -; -; -; -; -; -; -; -; -,-; -; -; -; -; -; -; -; -; -; -,-; -; -; -; -; -; -; -; -; -; -,-; -; -; -; -; -; -; -; -; -; -
